"term","type","label","description","domain","range"
"ParameterConnection","Class","ParameterConnection","A connection between parameters of different applications",,
"connection","Property","connection","A parameter connection created by this workflow","ComputationalWorkflow HowToStep","ParameterConnection"
"sourceParameter","Property","sourceParameter","The source (upstream) parameter","ParameterConnection","FormalParameter"
"targetParameter","Property","targetParameter","The target (downstream) parameter","ParameterConnection","FormalParameter"
"md5","Property","md5","md5 checksum as a hexadecimal string","File","Text"
"sha1","Property","sha1","sha1 checksum as a hexadecimal string","File","Text"
"sha256","Property","sha256","sha256 checksum as a hexadecimal string","File","Text"
"sha512","Property","sha512","sha512 checksum as a hexadecimal string","File","Text"
